{
  "schema": "crowsi://control/pep-execution-lease/v2",
  "reservation_id": "release-reservation.sample.1",
  "command": {
    "schema": "crowsi://control/isolation-command/v2",
    "command_id": "command.v2.sample",
    "jti": "jti.command.v2.sample",
    "security_domain": "customer-sample",
    "deployment_id": "deployment.sample.1",
    "incident_id": "incident.sample.1",
    "target_id": "incus://project/default/instance/worker-a",
    "release_id": "release.sample.1",
    "release_digest": "sha256:bbbbbbbbbbbbbbbbbbbbbbbbbbbbbbbbbbbbbbbbbbbbbbbbbbbbbbbbbbbbbbbb",
    "checkpoint_id": "checkpoint.sample.1",
    "checkpoint_digest": "sha256:cccccccccccccccccccccccccccccccccccccccccccccccccccccccccccccccc",
    "checkpoint_sequence": 42,
    "release_reservation_id": "release-reservation.sample.1",
    "enforcement_grant_jti": "jti.grant.sample.1",
    "decision_id": "decision.sample.1",
    "pairwise_subject": "subject-sample",
    "actor": "operator-sample",
    "device": "device-sample",
    "workload": "spiffe://crowsi.local/rescue-console/sample",
    "profile": "security-operator",
    "proof_key_ref": "proof-key-sample",
    "revocation_epoch": 7,
    "binding": {
      "audience": "crowsi-enforcer-incus",
      "resource": "incus://project/default/instance/worker-a",
      "action": "quarantine",
      "purpose": "incident-containment",
      "channel": "emergency-console"
    },
    "provider": "crowsi-enforcer-incus",
    "previous_fence_epoch": 8,
    "fence_epoch": 9,
    "expected_resource_version": "incus-etag-7",
    "issued_at": "2026-07-29T00:01:30.000Z",
    "expires_at": "2026-07-29T00:02:30.000Z",
    "signed": {
      "algorithm": "ed25519",
      "key_id": "command.sample.1",
      "digest": "sha256:61b5d2b62d62e8d780afae31a150d51b560c42d833a0437f18b497f2d2e27164",
      "signature": "aaaaaaaaaaaaaaaaaaaaaaaaaaaaaaaaaaaaaaaaaaaaaaaaaaaaaaaaaaaaaaaaaaaaaaaaaaaaaaaaaaaaaa"
    }
  },
  "command_digest": "sha256:61b5d2b62d62e8d780afae31a150d51b560c42d833a0437f18b497f2d2e27164",
  "reserved_at": "2026-07-29T00:01:45.000Z"
}
